{
  "name": "Voicetowebsite",
  "palette": {
    "bg": "#06090f",
    "canvas": "#06090f",
    "surface": "rgba(255,255,255,0.04)",
    "surface-strong": "rgba(12,16,28,0.82)",
    "ink": "#e2e8f0",
    "chrome": "#f0f2f8",
    "muted": "rgba(203,213,225,0.78)",
    "accent": "#c084fc",
    "highlight": "#22d3ee",
    "prism-1": "#c084fc",
    "prism-2": "#22d3ee",
    "prism-3": "#818cf8",
    "line": "rgba(148,163,184,0.14)"
  },
  "motion": {
    "hero": "orbital-rise",
    "sections": "signal-slide"
  },
  "updatedAt": "2026-04-14T00:00:00.000Z"
}
